{
  "schema_version": "1.0",
  "profile_id": "00000000000000000000000000",
  "projection": {
    "projection_version": "0.0.0",
    "params_hash": "0000000000000000000000000000000000000000000000000000000000000000",
    "last_seq": 0,
    "rebuilt_at": "2026-01-15T09:30:00Z",
    "merge_cursor": {
      "hlc": "000000000000000-00000",
      "device_id": "x",
      "origin_seq": 1
    }
  },
  "profile": {
    "display_name": "x",
    "level": "O",
    "subjects": [
      {
        "subject": "mathematics",
        "level": "O"
      }
    ],
    "locale": "aa",
    "support_level": "standard"
  },
  "kc_states": [],
  "review_cards": [],
  "misconceptions": [],
  "preferences": {
    "start_style": {
      "worked_example": {
        "alpha": 0,
        "beta": 0
      },
      "hint": {
        "alpha": 0,
        "beta": 0
      }
    },
    "representation": {
      "diagram": {
        "alpha": 0,
        "beta": 0
      },
      "simpler_numbers": {
        "alpha": 0,
        "beta": 0
      },
      "analogy": {
        "alpha": 0,
        "beta": 0
      },
      "worked_example": {
        "alpha": 0,
        "beta": 0
      }
    },
    "unprompted_help": true,
    "self_explanation_prompts": true
  },
  "engagement": {
    "streak_days": 0,
    "freezes_left": 0,
    "last_active_date": "2026-01-15",
    "minutes_7d": 0,
    "sessions_7d": 0,
    "frustration": 0
  },
  "notes": []
}
